{
  "task_id": "b53fc5a7-d121-49bd-8417-2195a64566a2",
  "reviewer": "bala-revisor",
  "independent": true,
  "status": "APPROVED",
  "checks": [
    {
      "name": "integridade_taskpack_e_correcao",
      "result": "PASS",
      "evidence": "All SHA256 entries verified. Current checkpoint/hooks/checklist reopened; scripts/source evidence unchanged."
    },
    {
      "name": "gate_envio_A12_corrigido",
      "result": "PASS",
      "evidence": "Screen EN literalT03 has7words;ES literalT03 has8words. Both<=9 TOTAL; extra lines removed; checklist corrected. Previous blocker resolved."
    },
    {
      "name": "fidelidade_visual_e_estrutura",
      "result": "PASS",
      "evidence": "Personal review timeline01-13,253samples,frames6.8/41.6 and sources. Car selfie preserved, no physical butterfly. Selection/save/tonight,3affirmations,4sign routes,bridge/return preserved. Financial speech adaptation explicitly authorized."
    },
    {
      "name": "fonte_e_limites_evidenciais",
      "result": "PASS",
      "evidence": "Save this/app Tova corrections supported by visible captions; ASR limitations disclosed. Organic visual classification caveated; no direct listening claim."
    },
    {
      "name": "copy_idiomas_cta_compliance",
      "result": "PASS",
      "evidence": "9takes EN/PT and ES/PT,20-26words. No guaranteed sign/income or unsupported app functions. 222/like/save,Stories/profile/bio/followfinal. Checklist14/14 applicable13NA."
    },
    {
      "name": "estado_e_trava_luigi",
      "result": "PASS",
      "evidence": "WAITING_SCRIPT_APPROVAL/NOT_APPROVED; hooks not approved,prompts not created. Next action checks current approved report then presents to Luigi; packages require real approval."
    },
    {
      "name": "agregado_literal_e_rotacao",
      "result": "PASS",
      "evidence": "All6 aggregate tables literally identical,52takes. Distinct argument routes; phrase detector exit0."
    },
    {
      "name": "pacote_midia_e_desempenho",
      "result": "NOT_APPLICABLE",
      "evidence": "No K/V/media/direct listening/performance certification; user approval pending."
    }
  ],
  "findings": [
    {
      "severity": "WARNING",
      "message": "Estimated67-77s exceeds50.663s original; CTA/follow extension disclosed. Actual duration depends on takes/editing.",
      "evidence": "Script duration note and manifest."
    }
  ]
}
