{
  "task_id": "20eac346-b95d-4005-b61d-83fc03772cea",
  "reviewer": "bala-revisor",
  "independent": true,
  "status": "APPROVED",
  "checks": [
    {
      "name": "integridade_e_delta_final",
      "result": "PASS",
      "evidence": "All SHA256 entries verified; only checkpoint and aggregate changed since approved V02_r1."
    },
    {
      "name": "estado_e_aprovacao",
      "result": "PASS",
      "evidence": "WAITING_SCRIPT_APPROVAL/NOT_APPROVED; prompts NOT_CREATED; Avery/Devon/Jordan order preserved."
    },
    {
      "name": "evidencia_visual_e_fidelidade",
      "result": "PASS",
      "evidence": "Personal review timeline01-15,297samples,frames2.6/48.6/53.4 and sources. Deck/Empress/reaction/framing preserved. Four player texts recovered visually; ASR limits disclosed."
    },
    {
      "name": "estrutura_copy_e_compliance",
      "result": "PASS",
      "evidence": "10takes EN/PT and ES/PT;10attributes,3desires,4affirmations preserved. Aya/UI removed; no unsupported app function, financial guarantee or fabricated testimonial. Checklist14/14 applicable13NA."
    },
    {
      "name": "cta_idioma_tempo_e_hooks",
      "result": "PASS",
      "evidence": "222/like/save,Stories/profile/bio,followfinal. Takes<=27words;68-80s estimate disclosed versus59.440s. Faithful hook, literal screen<=9words,Jordan ES/luxury equivalent. All talking."
    },
    {
      "name": "agregado_e_rotacao",
      "result": "PASS",
      "evidence": "6 aggregate tables literally identical,52takes. Argument routes distinct across3models; phrase detector exit0."
    },
    {
      "name": "pacotes_e_midia",
      "result": "NOT_APPLICABLE",
      "evidence": "No K/V/media/direct audio-listening certification; user approval pending."
    }
  ],
  "findings": [
    {
      "severity": "WARNING",
      "message": "Original app player demonstration becomes avatar speech; explicitly disclosed deviation avoids unsupported app function.",
      "evidence": "Analysis/Puzzle,T07,frames48.6/53.4."
    },
    {
      "severity": "WARNING",
      "message": "Estimated68-80s exceeds59.440s original; actual duration depends on future takes.",
      "evidence": "Script duration note and manifest."
    }
  ]
}
